{
  "$schema": "../schemas/ttl-batch-sizing-policy.schema.json",
  "id": "ttl-batch-sizing-policy/default",
  "version": "1.0.0",
  "runtime": {
    "ttl_seconds": 600,
    "ttl_renewable": false,
    "note": "TTL is non-renewable by design — preserves the isolation guarantee of ephemeral dispatch. Do not propose making it renewable; the fix is structural in pre-dispatch planning."
  },
  "ceiling": {
    "empirical_value": 18,
    "calibration_basis": "Initial empirical estimate ~15-18 items per dispatch at TTL 600s for typical codegen workloads. Pending replacement with measured telemetry from viv-aidlc-orchestrator#12.",
    "workload_type": "<WORKLOAD_TYPE>",
    "last_calibrated": "2026-05-22"
  },
  "safety_margin": 0.8,
  "cap_formula": "floor(ceiling.empirical_value * safety_margin)",
  "failure_policies": {
    "default": "abort",
    "allowed": ["abort", "skip", "retry"],
    "per_category_recommendation": {
      "backend-implementer": { "policy": "abort", "rationale": "Items typically share contracts; one broken item invalidates downstream items." },
      "frontend-implementer": { "policy": "skip",  "rationale": "Components are often independent; partial completion preserves value." },
      "migration-agent":      { "policy": "abort", "rationale": "Schema statements may have ordering dependencies; rollback preserves invariants." },
      "codegen-stubs":        { "policy": "skip",  "rationale": "Stubs are independent; partial scaffolding has value." },
      "test-generator":       { "policy": "skip",  "rationale": "Tests are independent; missing tests are visible to humans." },
      "external-api-caller":  { "policy": "retry", "rationale": "Transient failures justify one re-attempt; second failure falls back to abort." }
    }
  },
  "evidence_requirements": {
    "items_completed_field": "Items completed",
    "items_skipped_field":   "Items skipped",
    "items_retried_field":   "Items retried",
    "policy_field":          "Failure policy"
  },
  "telemetry": {
    "per_item_duration_ms":  true,
    "per_dispatch_total_ms": true,
    "items_completed_ratio": true,
    "truncation_observed":   true
  },
  "note": "Consumers MUST compute cap as floor(ceiling.empirical_value * safety_margin). With the defaults above: floor(18 * 0.8) = 14. Dispatching more than 14 items in one Agent() call requires explicit justification per viv-orchestration-rules ADR-005."
}
